id,name,list_ingrid,image_url,list_bzu,list_resipe,recept_link
4c932772-ce8a-11ea-8c8e-0242ac1c0002,Потофё,"['Говяжьи голяшки', 'Говядина', 'Говяжьи ребра', 'Мозговые кости', 'Гвоздика', 'Лук репчатый', 'Букет гарни', 'Лавровый лист', 'Соль', 'Стебель сельдерея', 'Морковь', 'Лук-порей', 'Репа', 'Молодой картофель', 'Французский багет', 'Душистый перец горошком']",['//eda.ru/img/eda/-x900i/s2.eda.ru/StaticContent/Photos/120213175433/180412194629/p_O.jpg'],"['Калорийность 988 ккал', 'Белки 87,5 грамм', 'Жиры 47,9 грамм', 'Углеводы 51,5 грамм']","['1. Обернуть мозговую кость марлей и перевязать, голяшки и остальное мясо плотно завязать кулинарной нитью, чтобы мясо не развалилось во время варки. Поместить все говяжьи части на дно кастрюли, залить водой, довести до кипения, снять пену и снизить огонь.', '2. Луковицу разрезать пополам, не очищая ее. Воткнуть в половинки лука гвоздику, поджарить лук на сухой сковороде на стороне разреза до темно-коричневого цвета. Бросить лук в кастрюлю к мясу. Добавить также букет гарни, перец горошком, лавровый лист. Варить на небольшом огне 2,5 часа. Посолить.', '3. Поместить в марлевый мешочек отдельно каждый вид овощей: крупно нарезанные сельдерей, морковь, порей, разрезанные пополам репу и картофель. Отправить их вариться в бульон в течение 30–40 минут. Как только овощ станет мягким, доставать его из кастрюли, пока он не превратился в пюре.', '4. Когда все овощи будут готовы, процедить бульон через сито с марлей. Выбросить луковицу и букет гарни.', '5. Потофё подавать отдельно: на поджаренный хлеб намазать костный мозг, в большие тарелки выложить вареные овощи и кусочки мяса, а в небольшие глубокие тарелки разлить насыщенный мясной бульон.']",https://eda.ru/recepty/bulony/potofyo-114696
4caabb44-ce8a-11ea-84af-0242ac1c0002,Грибной бульон,"['Сушеные грибы', 'Вода']",['//eda.ru/img/eda/-x900i/s1.eda.ru/StaticContent/Photos/120213174921/1202131749481/p_O.jpg'],"['Калорийность 24 ккал', 'Белки 2 грамм', 'Жиры 0,5 грамм', 'Углеводы 2,6 грамм']","['1. Промытые в теплой воде сухие грибы положить в кастрюлю, добавить очищенную и разрезанную пополам луковицу, залить холодной водой и варить при слабом кипении в течение 2 — 2 1/2 часов. Для ускорения варки грибы можно предварительно замочить на 1–2 часа в холодной воде, в которой их потом и варить.', '2. Готовый бульон процедить, грибы промыть холодной водой, мелко нашинковать и положить в суп, приготовляемый из грибного бульона.']",https://eda.ru/recepty/bulony/gribnoj-bulon-14612
4cb34b9c-ce8a-11ea-9715-0242ac1c0002,Бульон с фрикадельками,"['Мясной бульон', 'Мясо', 'Соль', 'Перец черный молотый', 'Петрушка']",['//eda.ru/img/eda/-x900i/s1.eda.ru/StaticContent/Photos/120213174921/1202131749560/p_O.jpg'],"['Калорийность 119 ккал', 'Белки 13,2 грамм', 'Жиры 7,5 грамм', 'Углеводы 0 грамм']","['1. Мякоть сырого мяса пропустить два-три раза через мясорубку, прибавить соль, перец и 2 столовые ложки холодной воды. Полученную массу тщательно перемешать, разделать в виде шариков (фрикаделек) и опустить их в готовый кипящий мясной или куриный бульон. Затем фрикадельки вынуть шумовкой и разложить в тарелки по 8-10 штук.', '2. Бульон процедить и залить им фрикадельки, сверху посыпать зеленью петрушки.']",https://eda.ru/recepty/bulony/bulon-s-frikadelkami-14657
4d21f6aa-ce8a-11ea-b871-0242ac1c0002,Классический рыбный бульон,"['Рыбные кости', 'Рыбные обрезки', 'Морковь', 'Корень петрушки', 'Лук репчатый', 'Соль', 'Черный перец горошком', 'Перец черный молотый', 'Зелень']",['//eda.ru/img/eda/-x900i/s2.eda.ru/StaticContent/Photos/161229143423/170113161538/p_O.jpg'],"['Калорийность 161 ккал', 'Белки 30,3 грамм', 'Жиры 2,4 грамм', 'Углеводы 4,9 грамм']","['1. Головы, кости и плавники рыбы хорошо промыть, уложить в кастрюлю, залить холодной водой и на слабом огне довести до кипения.', '2. Уменьшить огонь и варить один час.', '3. Затем положить овощи и довести до готовности.', '4. Готовый бульон процедить, заправить солью и перцем, посыпать зеленью.']",https://eda.ru/recepty/bulony/klassicheskiy-rybnyy-bulon-91810
4d4357b4-ce8a-11ea-84af-0242ac1c0002,Винный бульон,"['Лук репчатый', 'Морковь', 'Лук-порей', 'Стебель сельдерея', 'Петрушка', 'Чабрец', 'Стебель фенхеля', 'Чеснок', 'Лавровый лист', 'Вода', 'Соль', 'Черный перец горошком', 'Белое вино']",['//eda.ru/img/eda/-x900i/s2.eda.ru/StaticContent/Photos/110801145258/120214133943/p_O.jpg'],[],"['1. Нашинковать овощи, сельдерей порезать кубиками. Положить овощи в большую кастрюлю и залить водой. Довести до кипения, убавить огонь, накрыть крышкой и варить около 15 минут. Добавить вино и варить еще 15 минут. В самом конце кинуть перец горошком.']",https://eda.ru/recepty/bulony/vinnij-bulon-26052
4d52d392-ce8a-11ea-8c8e-0242ac1c0002,Рыбный бульон ‑ Фуме,"['Голова трески', 'Соль', 'Растительное масло', 'Лук репчатый', 'Лук', 'Лук-порей', 'Манная крупа', 'Сельдерей', 'Чеснок', 'Белое сухое вино', 'Петрушка', 'Листья эстрагона', 'Лавровый лист', 'Черный перец горошком']",[],"['Калорийность 294 ккал', 'Белки 7,4 грамм', 'Жиры 9,6 грамм', 'Углеводы 40 грамм']","['1. В миске залейте холодной водой рыбьи косточки и головы. Добавьте соль, перемешайте до растворения соли и оставьте на час.', '2. Слейте воду. Промойте под проточной водой, тщательно очищая от крови «проблемные» участки (например, рядом с позвоночником).', '3. В большой кастрюле подогрейте масло на среднем огне. Добавьте лук, фенхель, лук-порей, сельдерей, чеснок и пассеруйте примерно 3 минуты. Овощи должны стать мягкими. Добавьте рыбьи кости и головы. Влейте вино и доведите до кипения. Добавьте 4 стакана воды, петрушку, эстрагон, лавровый лист, горошины черного перца.', '4. Доведите до кипения и готовьте на медленном огне 20 минут. Убирите накипь ложкой при необходимости.', '5. Процедите готовый рыбный бульон через плотное ситечко. Можно хранить охлажденный бульон 5 дней в холодильнике. В морозилке этот бульон может храниться до 3 месяцев.']",https://eda.ru/recepty/bulony/ribnij-bulon-fume-53711
4d64e9b0-ce8a-11ea-9715-0242ac1c0002,Куриный бульон с манными клецками,"['Курица', 'Морковь', 'Лук репчатый', 'Петрушка', 'Сельдерей', 'Сливочное масло', 'Манная крупа', 'Яйцо куриное', 'Соль', 'Зелень']",['//eda.ru/img/eda/-x900i/s2.eda.ru/StaticContent/Photos/120131082543/120214123713/p_O.jpg'],"['Калорийность 461 ккал', 'Белки 28,2 грамм', 'Жиры 27,4 грамм', 'Углеводы 26,7 грамм']","['1. Курицу залить холодной водой и довести до кипения. Снять пену, добавить морковь, сельдерей, петрушку и лук. Посолить. Варить до готовности.', '2. Вынуть курицу, отделить мясо от костей и разделать на небольшие кусочки.', '3. Процедить бульон и вновь поставить на огонь. Добавить куриное мясо.', '4. Замесить тесто из манной крупы со сливочным маслом, яйцом и солью. Разделить тесто на клецки и опустить в бульон.', '5. Посыпать готовый бульон рубленой зеленью.']",https://eda.ru/recepty/bulony/kurinij-bulon-s-mannimi-kleckami-22642
4da1295c-ce8a-11ea-b871-0242ac1c0002,Концентрированный телячий бульон для соусов,"['Телячьи кости', 'Телячья лопатка', 'Лук репчатый', 'Морковь', 'Корень сельдерея', 'Лук-порей', 'Букет гарни', 'Телячья нога']",['//eda.ru/img/eda/-x900i/s2.eda.ru/StaticContent/Photos/140124100744/161115131036/p_O.jpg'],"['Калорийность 597 ккал', 'Белки 103,9 грамм', 'Жиры 16 грамм', 'Углеводы 9,6 грамм']","['1. Накануне 30-40 минут запекайте на противне при 200 С 2 кг разрубленных телячьих костей и 150 г лопатки или рульки кусками.', '2. На сковороде на сильном огне обуглите (до черноты) 2 очищенные и разрезанные пополам луковицы (срезом вниз).', '3. Почистите 150 г моркови, 100 г сельдерея и 100 г белого стебля лука-порея.', '4. Нарежьте мелкими кусочками.', '5. Положите кости и мясо в большую кастрюлю.', '6. Слейте с противня жир и дегласируйте 1 стаканом воды. Перелейте получившийся сок в кастрюлю.', '7. Добавьте овощи, лук, 1/2 ножки теленка и 1 букет гарни.', '8. Подрумянивайте 5 минут на большом огне.', '9. Залейте с верхом холодной водой, доведите до кипения, затем при очень слабом кипении варите без крышки 4 часа, постоянно снимая пену.', '10. Процедите бульон и дайте остыть. Уберите в холодильник на всю ночь.', '11. На следующий день снимите с поверхности застывший жир, перелейте жидкость в кастрюлю и выпарите наполовину, чтобы получить концентрированный бульон.']",https://eda.ru/recepty/bulony/koncentrirovannyy-telyachiy-bulon-dlya-sousov-81301
4de1f676-ce8a-11ea-84af-0242ac1c0002,Бульон куриный с клецками из мацы,"['Лук репчатый', 'Маца', 'Рубленая петрушка', 'Растительное масло', 'Яйцо куриное', 'Тертый имбирь', 'Куриный бульон', 'Соль', 'Перец черный молотый']",['//eda.ru/img/eda/-x900i/s2.eda.ru/StaticContent/Photos/120131085657/120213175549/p_O.jpg'],"['Калорийность 184 ккал', 'Белки 7,6 грамм', 'Жиры 13 грамм', 'Углеводы 9,2 грамм']","['1. Замочить мацу в холодной воде в течение 5 минут, слить и отжать.', '2. Обжарить лук в масле до золотистого цвета.', '3. Нашинковать петрушку. Взбить слегка яйца.', '4. Смешать отжатую мацу, жареный лук, петрушку и яйца. Приправить солью, перцем и имбирем, добавить муку. Охлаждать 1 час.', '5. Скатать маленькие шарики, окунуть их в кипящий суп и варить около 20 минут.', '6. Подавать, украсив петрушкой.']",https://eda.ru/recepty/bulony/bulon-kurinij-s-kleckami-iz-maci-16656
4e023666-ce8a-11ea-8c8e-0242ac1c0002,Густой рыбный суп с овощами и сливками (Ватерзой),"['Сливки 25%-ные', 'Треска', 'Яичный желток', 'Рыбный бульон', 'Лук-порей', 'Морковь', 'Корень сельдерея', 'Картофель', 'Петрушка', 'Укроп', 'Лавровый лист', 'Соль', 'Перец черный молотый', 'Оливковое масло', 'Черный перец горошком']","['//eda.ru/img/eda/-x900i/s2.eda.ru/StaticContent/Photos/120515204458/120528182953/p_O.jpg', '//eda.ru/img/eda/-x900i/s2.eda.ru/StaticContent/Photos/150707173742/150713184854/p_O.jpg', '//eda.ru/img/eda/-x900i/s2.eda.ru/StaticContent/Photos/140902214744/140912105309/p_O.jpg', '//eda.ru/img/eda/-x900i/s1.eda.ru/StaticContent/Photos/130104145234/161002154415/p_O.jpg']","['Калорийность 836 ккал', 'Белки 53,9 грамм', 'Жиры 55,9 грамм', 'Углеводы 27,8 грамм']","['1. Отварить обычный рыбный бульон, рыбу вынуть, дать остыть, разобрать на крупные куски, удалить кости.', '2. Морковь, корень сельдерей помыть, почистить и нарезать соломкой. Картофель почистить и нарезать брусочками. Белую часть лука порея нарезать полукольцами.', '3. В кастрюле с толстым дном обжарить до мягкости лук-порей, затем туда добавить морковь и сельдерей, готовить 10 минут, постоянно помешивая.', '4. Влить бульон, положить картофель, довести до кипения, положить лавровый лист и перец горошком, накрыть крышкой и готовить на медленном огне еще минут 15.', '5. Добавить рыбу, дать закипеть и готовить еще 10 минут.', '6. Аккуратно вынуть рыбу.', '7. Смешать половник подостывшего бульона из супа, желток и сливки, влить все в суп, посолить, поперчить, прогреть, но не кипятить, 3 минуты.', '8. В порционную тарелку положить кусок рыбы, залить бульоном с овощами, посыпать зеленью и подать на стол.']",https://eda.ru/recepty/bulony/gustoj-ribnij-sup-s-ovoschami-slivkami-vaterzoj-31792
4e267486-ce8a-11ea-9715-0242ac1c0002,Бульон с макаронными изделиями,"['Вермишель', 'Мясной бульон']",['//eda.ru/img/eda/-x900i/s1.eda.ru/StaticContent/Photos/120213174921/120213174954/p_O.jpg'],"['Калорийность 238 ккал', 'Белки 12 грамм', 'Жиры 2,6 грамм', 'Углеводы 41,1 грамм']","['1. Вермишель (лапшу, ушки или звездочки) опустить на 2-3 минуты в кипящую воду, после чего переложить в кипящий прозрачный мясной или куриный бульон и доваривать до готовности в течение 12-15 минут. Мучные изделия отваривают в воде для сохранения прозрачности бульона.']",https://eda.ru/recepty/bulony/bulon-s-makaronnimi-izdelijami-14640
4e3889aa-ce8a-11ea-b871-0242ac1c0002,Говяжий бульон с вином зинфандель,"['Говяжьи кости', 'Лук репчатый', 'Морковь', 'Стебель сельдерея', 'Тимьян', 'Черный перец горошком', 'Вино', 'Петрушка', 'Растительное масло']",[],"['Калорийность 1288 ккал', 'Белки 143,3 грамм', 'Жиры 63,4 грамм', 'Углеводы 24,5 грамм']","['1. Разогреть масло на среднем огне в широкой и глубокой сковороде и добавить кости, посолить и поперчить. Жарить около пятнадцати минут до появления ярко-коричневой корочки.', '2. Кулинарными щипцами переложить кости в миску. Добавить в сковороду измельченный лук, морковь и сельдерей и тушить до мягкости десять минут. Вернуть в сковороду кости и залить 3 литрами воды, добавить вино зинфандель, тимьян, петрушку и черный перец горошком. Убавить огонь до слабого и варить три часа, пока объем жидкости не уменьшится до трех с половиной стаканов.', '3. Готовый бульон процедить и остудить в холодильнике. Перед использованием снять с поверхности застывший жир.']",https://eda.ru/recepty/bulony/govjazhij-bulon-s-vinom-zinfandel-42473
4e95983e-ce8a-11ea-84af-0242ac1c0002,Бульон даси с имбирем,"['Чеснок', 'Морская капуста', 'Тертый имбирь', 'Соль']",['//eda.ru/img/eda/-x900i/s1.eda.ru/StaticContent/Photos/110816121851/120213190510/p_O.jpg'],"['Калорийность 15 ккал', 'Белки 0,4 грамм', 'Жиры 0,6 грамм', 'Углеводы 2,1 грамм']","['1. Сушеные водоросли нарезать кусочками и залить водой и довести до кипения.', '2. Добавить имбирь, чеснок и поварить 5 минут.', '3. Посолить, накрыть крышкой и дать настояться в течение получаса.']",https://eda.ru/recepty/bulony/bulon-dasi-s-imbirem-22285
4ec3448c-ce8a-11ea-9715-0242ac1c0002,Бульон с гречневой лапшой и морскими гребешками,"['Морская капуста', 'Мисо паста', 'Соевый соус', 'Имбирь', 'Морковь', 'Лапша соба', 'Гребешки', 'Королевские креветки', 'Зеленый лук', 'Соль', 'Перец черный молотый']",['//eda.ru/img/eda/-x900i/s1.eda.ru/StaticContent/Photos/120214122930/120214123443/p_O.jpg'],"['Калорийность 310 ккал', 'Белки 40,3 грамм', 'Жиры 4,8 грамм', 'Углеводы 28,5 грамм']","['1. Залейте холодной водой морскую капусту и доведите до кипения. Добавьте пасту мисо и соевый соус. Варите 5 минут.', '2. Очистите морковь и нарежьте соломкой. Добавьте в бульон. Варите 3 минуты.', '3. На несколько минут опустите в бульон имбирь.', '4. Добавьте в бульон гребешки, креветки и варите 2 минуты.', '5. Отварите отдельно лапшу и добавьте в бульон.', '6. Мелко порубите лук и посыпьте бульон.']",https://eda.ru/recepty/bulony/bulon-s-grechnevoj-lapshoj-morskimi-grebeshkami-22487
4ed7d136-ce8a-11ea-8c8e-0242ac1c0002,Кокосовый суп,"['Кокосовое молоко', 'Куриный бульон', 'Шампиньоны', 'Куриная грудка', 'Морковь', 'Имбирь', 'Красный перец чили', 'Рыбный соус', 'Сахар', 'Перец черный молотый', 'Лимонная трава', 'Паприка']",['//eda.ru/img/eda/-x900i/s2.eda.ru/StaticContent/Photos/120131084848/120213181936/p_O.jpg'],"['Калорийность 556 ккал', 'Белки 49,3 грамм', 'Жиры 27,6 грамм', 'Углеводы 28,5 грамм']","['1. Кокосовое молоко и куриный бульон влить в кастрюлю, довести до кипения и добавить нарезанную колечками морковь и крупно порубленный имбирь. Ту да же добавить чили перчик и предварительно подавленную плоскостью ножа лимонную траву (при желании). Варить 10 мин.', '2. Шампиньоны и куриное филе (при желании можно заменить креветками или любыми другими морепродуктами) нарезать и добавить в кипящий суп. Варить 8 мин.', '3. Влить в суп столовую ложку рыбного соуса, добавить сахар и оставшиеся специи, варить ещё 3 мин, постоянно помешивая.']",https://eda.ru/recepty/bulony/kokosovij-sup-19169
4eed75cc-ce8a-11ea-b871-0242ac1c0002,Бульон даши,"['Вода', 'Сушеные анчоусы', 'Сушеная ламинария']",[],"['Калорийность 44 ккал', 'Белки 6,1 грамм', 'Жиры 1,5 грамм', 'Углеводы 1,4 грамм']","['1. У анчоусов отрываем голову, а филе разрываем пополам вдоль хребта.', '2. Водоросль чистим от соли влажной салфеткой. Кладем в холодную воду анчоусы и водоросли, на большом огне быстро доводим до кипения, снимая пенки. Как закипело сразу достаем водоросли и выбрасываем. Уменьшаем огонь и варим анчоусы 7 минут.', '3. НЕМЕДЛЕННО убираем кастрюлю с плиты и процеживаем через марлю. Бульон должен получиться цвета слабого зеленого чая, с чуть солоноватым вкусом.']",https://eda.ru/recepty/bulony/bulon-dashi-46327
