id,name,list_ingrid,image_url,list_bzu,list_resipe,recept_link
47b742a6-ce8a-11ea-84af-0242ac1c0002,Куриный бульон с яйцом и чипсом из куриной кожи,"['Куриная кожа с жиром', 'Куриные кости', 'Соль', 'Петрушка', 'Лук репчатый', 'Чеснок', 'Вода', 'Укроп', 'Яйцо куриное', 'Белый хлеб', 'Твердый сыр']",['//eda.ru/img/eda/-x900i/s1.eda.ru/StaticContent/Photos/120131082409/170502150712/p_O.jpg'],"['Калорийность 3517 ккал', 'Белки 92,3 грамм', 'Жиры 290,1 грамм', 'Углеводы 126,6 грамм']","['1. В кастрюлю закладываем кости, ботву, ½ часть луковицы и чеснок. Варим на среднем огне примерно 25-30 мин.', '2. Пока варится бульон, делаем чипсы. Расстилаем кожу на противне, солим и готовим под прессом в духовке, при 150 гр. – 20 минут.', '3. Варим яйца, после закипания, не более 5 минут (чтобы получился жидкий желток), затем сливаем кипяток и заливаем холодной водой. При варке яиц, в воду необходимо добавить пару щепоток соли, чтобы в следствии они лучше чистились.', '4. Для гренок, произвольно нарываем хлеб, затем выкладываем на противень. Посыпаем мелко натертым твердым сыром и поливаем вытопленным жиром от кожи. Подсушиваем в духовке в течение 5-7 минут, при 150 гр., в духовке.', '5. Бульон процеживаем и солим, обязательно в конце, чтобы он не помутнел в процессе варки. Сервируем на свой вкус.']",https://eda.ru/recepty/bulony/kurinyy-bulon-s-yaycom-i-chipsom-iz-kurinoy-kozhi-93009
48019d10-ce8a-11ea-b871-0242ac1c0002,Куриные грудки в бульоне,"['Куриная грудка', 'Сельдерей', 'Лук репчатый', 'Морковь']",['//eda.ru/img/eda/-x900i/s2.eda.ru/StaticContent/Photos/120131082509/120214155839/p_O.jpg'],"['Калорийность 70 ккал', 'Белки 12,4 грамм', 'Жиры 1 грамм', 'Углеводы 3,2 грамм']","['1. Приготовить овощной бульон с любыми любимыми вами бульонными овощами и зеленью. Прокипятить все минут 10.', '2. Положить в бульон свежие куриные грудки (разрезать грудку на 4 части вдоль), вскипятить (не варить!) и выключить, закрыв крышкой. Когда бульон абсолютно остынет — нежнейшие, моментальные грудки готовы.']",https://eda.ru/recepty/bulony/kurinie-grudki-v-bulone-30282
4838c394-ce8a-11ea-9715-0242ac1c0002,Куриный бульон с мирпуа,"['Курица', 'Лук репчатый', 'Морковь', 'Петрушка', 'Сельдерей', 'Тимьян', 'Лавровый лист', 'Черный перец горошком', 'Крупная соль']",['//eda.ru/img/eda/-x900i/s2.eda.ru/StaticContent/Photos/120214124812/120214125115/p_O.jpg'],"['Калорийность 749 ккал', 'Белки 61,7 грамм', 'Жиры 52,7 грамм', 'Углеводы 7,5 грамм']","['1. Все ингредиенты положить в большую кастрюлю, залить холодной водой (около 4-х литров), довести до кипения и варить около 2-х часов на медленном огне', '2. Готовый бульон остудить и процедить']",https://eda.ru/recepty/bulony/kurinyy-bulon-s-mirpua-23371
484701e8-ce8a-11ea-8c8e-0242ac1c0002,Говяжий бульон,"['Лук репчатый', 'Телячья голень', 'Стебель сельдерея', 'Морковь', 'Лук-порей', 'Петрушка', 'Букет гарни']",[],"['Калорийность 8447 ккал', 'Белки 1274,9 грамм', 'Жиры 332,7 грамм', 'Углеводы 106 грамм']","['1. Разрежьте луковицы пополам. Выложите в кастрюлю стороной среза вниз и готовьте, не переворачивая, 5 минут. Затем выложите луковицы в большую кастрюлю.', '2. Обжарьте голень.', '3. В кастрюлю положите голень, лук, сельдерей, почищенную морковь, лук-порей, петрушку и букет гарни. Готовьте на среднем огне 20 минут, затем залейте 6 литрами воды, доведите до кипения, убавьте огонь и томите 2 12 часа, снимая пенку с бульона. Процедите бульон, охладите немного и снимите жир.']",https://eda.ru/recepty/bulony/govjazhij-bulon-54524
4858862a-ce8a-11ea-84af-0242ac1c0002,Рыбный бульон,"['Лук репчатый', 'Рыбные обрезки', 'Стебли петрушки', 'Лимонный сок', 'Соль', 'Белое сухое вино', 'Сливочное масло']",[],"['Калорийность 253 ккал', 'Белки 42,4 грамм', 'Жиры 1,7 грамм', 'Углеводы 14,6 грамм']","['1. Порубить острым ножом рыбные кости и все обрезки, сложить в смазанный сливочным маслом сотейник вместе с измельченным луком и петрушкой, добавить лимонный сок, соль, накрыть крышкой и потушить на среднем огне пять минут. Затем влить 800 мл воды и вино, довести до кипения и варить двадцать минут.', '2. Готовый бульон процедить.']",https://eda.ru/recepty/bulony/ribnij-bulon-42469
48b25402-ce8a-11ea-b871-0242ac1c0002,Рыбный бульон с белым вином,"['Рыбные кости', 'Оливковое масло', 'Лук репчатый', 'Лук-порей', 'Корень сельдерея', 'Чеснок', 'Семена кориандра', 'Молотый белый перец', 'Белое сухое вино', 'Укроп', 'Морковь']",['//eda.ru/img/eda/-x900i/s1.eda.ru/StaticContent/Photos/120213175134/1202131752280/p_O.jpg'],"['Калорийность 715 ккал', 'Белки 70,5 грамм', 'Жиры 33,5 грамм', 'Углеводы 23,3 грамм']","['1. Порезать рыбные кости на кусочки по 6 см. Подержать в холодной  воде 10 минут, просушить в дуршлаге.', '2. Разогреть масло в большой кастрюле. Добавить овощи, лук и специи, перемешать, затем готовить на слабом огне 5 минут, пока овощи не начнут становиться мягкими. Долить вино. Усилить огонь, довести до кипения, дать остыть в течение 2-х минут.', '3. Добавить рыбьи кости и 1,5 литра холодной воды. Довести до кипения на сильном огне, потом тут же сбавить огонь до самого слабого и слегка потрясти кастрюлю — все лишние кусочки всплывут на поверхность. Снять их половником, затем поставить кастрюлю обратно на умеренный огонь. Готовить около 20 минут, снимая с поверхности все лишние кусочки, которые будут всплывать.', '4. Слить бульон через дуршлаг в чистую кастрюлю, выловить все кости и овощи, а потом пропустить через мелкое сито в другую чистую кастрюлю. Бульон надо использовать сразу после приготовления. Или быстро охладить и поставить в холодильник, предварительно накрыв крышкой.']",https://eda.ru/recepty/bulony/ribnij-bulon-s-belim-vinom-15642
48d176fc-ce8a-11ea-9715-0242ac1c0002,Мясной бульон с овощами,"['Мясо', 'Лук репчатый', 'Морковь', 'Корень сельдерея', 'Лавровый лист', 'Соль', 'Молотый душистый перец']","['//eda.ru/img/eda/-x900i/s1.eda.ru/StaticContent/Photos/120131090342/120213185458/p_O.jpg', '//eda.ru/img/eda/-x900i/s2.eda.ru/StaticContent/Photos/141214012603/141222174406/p_O.jpg', '//eda.ru/img/eda/-x900i/s1.eda.ru/StaticContent/Photos/141214012603/141222174410/p_O.jpg']","['Калорийность 187 ккал', 'Белки 16,9 грамм', 'Жиры 10,5 грамм', 'Углеводы 6,7 грамм']","['1. Тщательно промойте мясо, залейте 3 литрами воды и доведите до кипения. Снимите пену или, если мясо слишком жирное, слейте весь бульон и заново залейте мясо водой. Варите 1,5 – 2 часа.', '2. Добавьте в кастрюлю морковь, лук и сельдерей. Посолите бульон, добавьте душистый перец, лавровый лист и варите еще 40 минут.', '3. Шумовкой достаньте из готового бульона морковь, лук, сельдерей и мясо.', '4. Для большей прозрачности процедите бульон через сито.']",https://eda.ru/recepty/bulony/myasnoy-bulon-s-ovoschami-21625
49029c64-ce8a-11ea-84af-0242ac1c0002,Домашняя курица в луково-яичном бульоне,"['Курица', 'Лук репчатый', 'Яйцо куриное', 'Соль', 'Зелень', 'Перец черный молотый']","['//eda.ru/img/eda/-x900i/s2.eda.ru/StaticContent/Photos/151212225533/151223122026/p_O.jpg', '//eda.ru/img/eda/-x900i/s2.eda.ru/StaticContent/Photos/151212225533/151223122046/p_O.jpg']","['Калорийность 635 ккал', 'Белки 49,9 грамм', 'Жиры 41,5 грамм', 'Углеводы 17,1 грамм']","['1. Разделать курицу на кусочки. Желательно чтобы птица была домашняя и не взрослая. От того какая она, зависит и вкус блюда. Промытое мясо положить в кастрюлю 3,5-4 л залить водой, варить сколько потребуется, для того чтобы мясо было мягким.', '2. Когда курица сварилась, процедить бульон, если он жирный и его осталось мало, можно добавить немного воды. Но бульон должен быть чуть выше мяса', '3. Мелко нарежем 8 средних луковиц и добавим к бульону', '4. Посолить и поперчить.', '5. Когда лук станет прозрачным добавить взбитые венчиком яйца. Все хорошо перемешать.', '6. Всю зелень, которую вы любите можно нарезать мелко и положить в суп. Я кладу укроп и петрушку не много, кинзу чуть больше и зелёный лук можно перьями для украшения уже готового блюда.']",https://eda.ru/recepty/bulony/domashnjaja-kurica-v-lukovo-jaichnom-bulone-55950
49122706-ce8a-11ea-8c8e-0242ac1c0002,Мясной бульон с травами,"['Вода', 'Говяжья грудинка', 'Говяжьи голяшки', 'Морковь', 'Сельдерей', 'Лук-шалот', 'Тимьян', 'Майоран', 'Лавровый лист', 'Гвоздика', 'Черный перец горошком', 'Соль', 'Растительное масло']",[],"['Калорийность 653 ккал', 'Белки 76,8 грамм', 'Жиры 36,4 грамм', 'Углеводы 5,6 грамм']","['1. Примерно половину голяшек, 1 луковицу и морковь смазать маслом, положить в большую форму для запекания и поставить под разогретый гриль. Запекать до золотистого цвета 15–20 минут. За это время 1 раз перевернуть.', '2. Мякоть говяжьей грудинки (или лопатки) нарезать кубиками со стороной 2–3 см. В оставшуюся луковицу воткнуть гвоздику. Поместить сырое мясо и кости в большую кастрюлю, залить 3,5 литрами холодной воды и оставить на 30 минут', '3. Добавить в кастрюлю обжаренные кости, поставить на небольшой огонь, довести до кипения, ни в коем случае не давая бурно кипеть. Снять пену, готовить на минимальном огне 4 часа.', '4. Положить соль, специи и овощи, готовить еще 1,5 часа. Добавить тимьян и майоран, готовить еще 30 минут. Процедить и охладить 1 час, снимая жир.']",https://eda.ru/recepty/bulony/myasnoy-bulon-s-travami-125778
49536ca2-ce8a-11ea-b871-0242ac1c0002,Бульон с сельдерееем,"['Корень сельдерея', 'Мясной бульон', 'Корень петрушки', 'Морковь']",['//eda.ru/img/eda/-x900i/s1.eda.ru/StaticContent/Photos/120213174921/1202131749551/p_O.jpg'],"['Калорийность 44 ккал', 'Белки 4,5 грамм', 'Жиры 1,4 грамм', 'Углеводы 4 грамм']","['1. Поставить варить мясной прозрачный бульон. Спустя час-полтора после того, как он закипит, добавить очищенные коренья — морковь, петрушку, сельдерей. Продолжать варку до полной готовности овощей.', '2. Готовый бульон процедить, разлить в бульонные чашки и подавать с гренками или пирожками.']",https://eda.ru/recepty/bulony/bulon-s-seldereeem-14652
496fe35a-ce8a-11ea-9715-0242ac1c0002,Куриный бульон с водорослями нори,"['Курица', 'Сельдерей', 'Лук репчатый', 'Морковь', 'Томатная паста', 'Лавровый лист', 'Сухие водоросли нори', 'Соль', 'Черный перец горошком']",['//eda.ru/img/eda/-x900i/s2.eda.ru/StaticContent/Photos/120214134655/150616141334/p_O.jpg'],"['Калорийность 377 ккал', 'Белки 31,3 грамм', 'Жиры 26,3 грамм', 'Углеводы 3,9 грамм']","['1. Курицу помыть, залить тремя литрами воды, положить в ту же кастрюлю, в компанию к курице, очищенные луковицу и морковь, стебель сельдерея. Довести воду в кастрюле до ки\xadпения, после чего убавить огонь до чуть ниже среднего, \xadчтобы жидкость тихо булькала. Снять пену.', '2. Бросить в бульон черный перец, предварительно раскрошив его в ступке, лавровый лист, добавить томатную пасту. Варить еще пятьдесят минут, затем посолить по вку\xadсу и процедить.', '3. Водоросли нори нарезать соломкой — тонкой или толстой. Подавать куриный бульон вместе с водорослями.']",https://eda.ru/recepty/bulony/kurinij-bulon-s-vodorosljami-nori-30993
499b3ac8-ce8a-11ea-84af-0242ac1c0002,Овощной суп на мясном бульоне,"['Мясо', 'Картофель', 'Морковь', 'Лук репчатый', 'Зелень', 'Специи', 'Оливковое масло']",[],"['Калорийность 152 ккал', 'Белки 6,5 грамм', 'Жиры 8,3 грамм', 'Углеводы 13,9 грамм']","['1. Мясо предварительно хорошо промыть и залить холодной водой.', '2. Довести до кипения, добавить 2 щепотки соли и варить на медленном огне, снимая пенку, 30–40 минут.', '3. Морковь натереть на терке, и мелко нарезать лук. Полученную смесь обжарить до золотистого цвета на сковородке с добавлением оливкового масла.', '4. Картофель нарезать на небольшие квадратики.', '5. Морковь, лук и картошку добавить в кипящую воду с мясом, уменьшить огонь и добавить специи.', '6. Оставить суп на медленном огне минут на 15.']",https://eda.ru/recepty/bulony/ovoshhnoj-sup-na-mjasnom-bulone-35269
49c7a55e-ce8a-11ea-8c8e-0242ac1c0002,Куриный бульон с имбирем и чесноком,"['Курица', 'Свежий корень имбиря', 'Чеснок', 'Зеленый лук', 'Соль']",[],"['Калорийность 390 ккал', 'Белки 30,9 грамм', 'Жиры 26,6 грамм', 'Углеводы 6,8 грамм']","['1. Имбирь, не очищая, нарезать по диагонали ломтиками толщиной 1 см. Чеснок, не очищая, слегка раздавить плоской стороной ножа', '2. Положить курицу (1,5 кг) или 600 гр куриного филе и 2 кг куриных каркасов, крыльев, шей и лапок в большую кастрюлю. Залить 4 л холодной воды и на небольшом огне довести до кипения. Уменьшить огонь до минимума - бульон не должен кипеть.', '3. Снимать поднимающуюся пену, не перемешивая бульон. Это может занять 20-30 минут. Добавить соль, имбирь, чеснок и белую часть зеленого лука. Варить 4 часа. Если используется целая курица, то, если есть желание использовать мясо для других рецептов, можно достать курицу из бульона через пару часов, срезать все мясо, а остальное вернуть в бульон и варить еще 2-2,5 часа', '4. Готовый бульон остудить. процедить. Охладить 1 час, удалить жир и использовать бульон для приготовления супов.']",https://eda.ru/recepty/bulony/kurinyy-bulon-s-imbirem-i-chesnokom-125594
49f22df6-ce8a-11ea-b871-0242ac1c0002,Бульон с кореньями и зеленью,"['Мясной бульон', 'Репа', 'Морковь', 'Цветная капуста', 'Шпинат', 'Стручковый зеленый горошек', 'Петрушка']",['//eda.ru/img/eda/-x900i/s2.eda.ru/StaticContent/Photos/120213174921/1202131749550/p_O.jpg'],"['Калорийность 48 ккал', 'Белки 5,6 грамм', 'Жиры 1,4 грамм', 'Углеводы 4,6 грамм']","['1. В горячий мясной или куриный бульон положить овощи — сначала морковь, репу и спаржу, нарезанные брусочками, цветную капусту, разобранную на мелкие соцветия, а затем стручки фасоли или горошка, разрезанные поперек на 2-3 части. Спустя 15-20 минут добавить нарезанные листики шпината или салата и дать бульону прокипеть в течение 2-3 минут.']",https://eda.ru/recepty/bulony/bulon-s-korenjami-zelenju-14651
4a1617fc-ce8a-11ea-9715-0242ac1c0002,Бульон с яйцом,"['Мясной бульон', 'Яйцо куриное']",['//eda.ru/img/eda/-x900i/s1.eda.ru/StaticContent/Photos/120213174921/1202131749553/p_O.jpg'],"['Калорийность 104 ккал', 'Белки 9,1 грамм', 'Жиры 7 грамм', 'Углеводы 0,4 грамм']","['1. Сварить мясной или куриный бульон, разлить в тарелки или бульонные чашки и опустить в каждую тарелку очищенное от скорлупы яйцо, сваренное в мешочек.']",https://eda.ru/recepty/bulony/bulon-s-jajcom-14654
4a2a1950-ce8a-11ea-84af-0242ac1c0002,Крепкий костный телячий бульон,"['Говяжьи голяшки', 'Телячья голень', 'Куриные крылья', 'Куриная спинка', 'Куриные шейки', 'Вода', 'Букет гарни', 'Чеснок', 'Лук репчатый', 'Соль', 'Морковь', 'Гвоздика']",['//eda.ru/img/eda/-x900i/s1.eda.ru/StaticContent/Photos/110801145439/120214133943/p_O.jpg'],[],"['1. На дно большой кастрюли поместите специальное проволочное дно, которое не даст подгореть мясу. На решетку выложите мясо и кости и залейте все водой. Доведите до кипения и удалите с помощью шумовки пену. Продолжайте снимать пену в течение 15 минут, пока она окончательно не исчезнет. Добавьте в кастрюлю букет гарни (который должен включать в себя лук-порей и сельдерей), чеснок, лук, морковь, добавьте соль. Доведите до кипения, снова соберите пену. Убавьте огонь до самого слабого, накройте крышкой и готовьте бульон 6-7 часов. Время от времени удаляйте с помощью шумовки с поверхности бульона жир.', '2. Готовый бульон процедите в большую миску, затем еще раз через дуршлаг, проложенный несколькими слоями марли. Дайте бульону остыть, затем уберите его в холодильник и дайте затвердеть. Удалите с поверхности весь жир и все следы жира с помощью салфетки.']",https://eda.ru/recepty/bulony/krepkij-kostnij-teljachij-bulon-26053
